author,description,format,genre,month,pages,publisher,rating,title,year
Richard Rothstein,"In this groundbreaking history of the modern American metropolis, Richard Rothstein, a leading authority on housing policy, explodes the myth that America’s cities came to be racially divided through ",Hardcover,History,May,368,Liveright,4.43,The Color of Law: A Forgotten History of How Our Government Segregated America,2017
Adam Federman,"For more than thirty years, Patience Gray--author of the celebrated cookbook ",Hardcover,Biography,September,400,Chelsea Green Publishing Company                          (first published June 2nd 2017,3.81,Fasting and Feasting: The Life of Visionary Food Writer Patience Gray,2017
Ayelet Gundar-Goshen,"Dr. Eitan Green is a good man. He saves lives. Then, speeding along a deserted moonlit road in his SUV, he hits someone. Seeing that the man, an African migrant, is beyond help, he flees the scene. It is a decision that changes everything. Because the dead man’s wife knows what happened. When she knocks at Eitan’s door the next day, tall and beautiful, he discovers that he",Hardcover,Fiction,March,409,Puskin Press                          (first published 2014,3.81,Waking Lions,2014
Mike  Wallace,"In this utterly immersive volume, Mike Wallace captures the swings of prosperity and downturn, from the 1898 skyscraper-driven boom to the Bankers' Panic of 1907, the labor upheaval, and violent repression during and after the First World War. Here is New York on a whole new scale, moving from national to global prominence -- an urban dynamo driven by restless ambition, bo",Hardcover,History,October,1200,Oxford University Press                          (first published October 2017,4.25,Greater Gotham: A History of New York City from 1898 to 1919,2017
James Forman Jr.,"In recent years, America’s criminal justice system has become the subject of an increasingly urgent debate. Critics have assailed the rise of mass incarceration, emphasizing its disproportionate impact on people of color. As James Forman, Jr., points out, however, the war on crime that began in the 1970s was supported by many African American leaders in the nation’s urban",Kindle Edition,Nonfiction,April,320,"Farrar, Straus and Giroux",4.37,Locking Up Our Own: Crime and Punishment in Black America,2017
Dominic Dromgoole,"Two years. 193,000 miles. 190 countries. One play. For the 450th anniversary of Shakespeare’s birth the Globe Theatre undertook an unparalleled journey, to take ",Hardcover,Nonfiction,April,320,Grove Press,3.72,Hamlet Globe to Globe,2017
Suzy Hansen,Suzy Hansen left her country and moved to Istanbul and discovered America,Hardcover,Nonfiction,August,288,"Farrar, Straus and Giroux",4.05,Notes on a Foreign Country: An American Abroad in a Post-American World,2017
Laura Dassow Walls,"“Walden. Yesterday I came here to live.” That entry from the journal of Henry David Thoreau, and the intellectual journey it began, would by themselves be enough to place Thoreau in the American pantheon. His attempt to “live deliberately” in a small woods at the edge of his hometown of Concord has been a touchstone for individualists and seekers since the publication of ",Hardcover,Biography,July,640,University of Chicago Press,4.49,Henry David Thoreau: A Life,2017
Michael Tisserand,"In the tradition of Schulz and Peanuts, an epic and revelatory biography of Krazy Kat creator George Herriman that explores the turbulent time and place from which he emerged—and the deep secret he explored through his art.",Hardcover,Biography,December,384,Harper                          (first published December 2016,4.30,Krazy: The Black and White World of George Herriman,2016
Alan F. Taylor,"<p>This book is an intimate, fond and funny memoir of one of the greatest novelists of the last century. This colourful, personal, anecdotal, indiscrete and admiring memoir charts the course of Muriel Spark's life revealing her as she really was. Once, she commented sitting over a glass of chianti at the kitchen table, that she was upset that the academic whom she had appoint</p>",Kindle Edition,Nonfiction,November,162,Polygon,3.89,Appointment in Arezzo: A Friendship With Muriel Spark,2017
Victor Sebestyen,<p> <b>Shortlisted for the Elizabeth Longford Prize for Historical Biography</b> </p>,Kindle Edition,History,February,593,Weidenfeld & Nicolson,4.26,Lenin the Dictator,2017
Dan Chaon,"<b>Two sensational unsolved crimes—one in the past, another in the present—are linked by one man’s memory and self-deception in this chilling novel of literary suspense from National Book Award finalist Dan Chaon.</b>",Hardcover,Fiction,March,496,Ballantine Books,3.35,Ill Will,2017
Jason Zinoman,<em>New York Times</em>,Hardcover,Biography,April,368,Harper,3.70,Letterman: The Last Giant of Late Night,2017
Charlie Veron,"Hailed by David Attenborough and proclaimed a second Charles Darwin, Charlie Veron has lived up to his namesake. Even as a toddler, he had a deep affinity with the natural world, and by school age he knew more about some sciences than his teachers did. This didn't prevent him failing in a system that smothered creativity, and it was only by chance that he went to universit",Paperback,Nonfiction,July,320,Penguin Books,4.31,A Life Underwater,2017
Emily Fridlund,"Fourteen-year-old Madeline lives with her parents in the beautiful, austere woods of northern Minnesota, where their nearly abandoned commune stands as a last vestige of a lost counter-culture world. Isolated at home and an outlander at school, Madeline is drawn to the enigmatic, attractive Lily and new history teacher Mr. Grierson. When Mr. Grierson is charged with posses",Hardcover,Fiction,January,288,Grove Atlantic,3.41,History of Wolves,2017
Peter Kimani,"""This funny, perceptive and ambitious work of historical fiction by a Kenyan poet and novelist explores his country’s colonial past and its legacy through the stories of three men involved with the building of a railroad linking Lake Victoria and the Indian Ocean--what the Kikuyu called the 'Iron Snake' and the British called the 'Lunatic Express.'""",Paperback,Fiction,February,342,Akashic Books,3.58,Dance of the Jakaranda,2017
Karin Roffman,<b>The first biography of an American master</b>,Hardcover,Biography,June,336,"Farrar, Straus and Giroux",4.28,The Songs We Know Best: John Ashbery's Early Life,2017
Monica Hesse,"A breathtaking feat of reportage, ",Hardcover,Nonfiction,July,255,Liveright,3.79,"American Fire: Love, Arson, and Life in a Vanishing Land",2017
