,title,author,description,genre,rating,publisher,pages,format,date,url
90,One Word Kill,Mark  Lawrence,"In January 1986, fifteen-year-old boy-genius Nick Hayes discovers hes dying. And it isnt even the strangest thing to happen to him that week.Nick and his Dungeons & Dragons-playing friends are used to living in their imaginations. But when a new girl, Mia, joins the group and reality becomes weirder than the fantasy world they visit in their weekly games, none of them
In January 1986, fifteen-year-old boy-genius Nick Hayes discovers he’s dying. And it isn’t even the strangest thing to happen to him that week.Nick and his Dungeons & Dragons-playing friends are used to living in their imaginations. But when a new girl, Mia, joins the group and reality becomes weirder than the fantasy world they visit in their weekly games, none of them are prepared for what comes next. A strange—yet curiously familiar—man is following Nick, with abilities that just shouldn’t exist. And this man bears a cryptic message: Mia’s in grave danger, though she doesn’t know it yet. She needs Nick’s help—now.He finds himself in a race against time to unravel an impossible mystery and save the girl. And all that stands in his way is a probably terminal disease, a knife-wielding maniac and the laws of physics.Challenge accepted.",Science Fiction,3.76,47North,194,Hardcover,"May 1st, 2019",https://www.goodreads.com/book/show/42036965-one-word-kill?from_choice=true
91,"To Be Taught, If Fortunate",Becky Chambers,"In her new novella, Sunday Times best-selling author Becky Chambers imagines a future in which, instead of terraforming planets to sustain human life, explorers of the solar system instead transform themselves. Ariadne is one such explorer. As an astronaut on an extrasolar research vessel, she and her fellow crewmates sleep between worlds and wake up each time with
In her new novella, Sunday Times best-selling author Becky Chambers imagines a future in which, instead of terraforming planets to sustain human life, explorers of the solar system instead transform themselves. Ariadne is one such explorer. As an astronaut on an extrasolar research vessel, she and her fellow crewmates sleep between worlds and wake up each time with different features. Her experience is one of fluid body and stable mind and of a unique perspective on the passage of time. Back on Earth, society changes dramatically from decade to decade, as it always does.Ariadne may awaken to find that support for space exploration back home has waned, or that her country of birth no longer exists, or that a cult has arisen around their cosmic findings, only to dissolve once more by the next waking. But the moods of Earth have little bearing on their mission: to explore, to study, and to send their learnings home. Carrying all the trademarks of her other beloved works, including brilliant writing, fantastic world-building and exceptional, diverse characters, Becky's first audiobook outside of the Wayfarers series is sure to capture the imagination of listeners all over the world.",Science Fiction,4.23,Harper Voyager,153,Paperback,September 3rd 2019,https://www.goodreads.com/book/show/43190272-to-be-taught-if-fortunate?from_choice=true
92,Wanderers,Chuck Wendig,"A decadent rock star. A deeply religious radio host. A disgraced scientist. And a teenage girl who may be the world's last hope.Shana wakes up one morning to discover her little sister in the grip of a strange malady. She appears to be sleepwalking. She cannot talk and cannot be woken up. And she is heading with inexorable determination to a destination that only she
A decadent rock star. A deeply religious radio host. A disgraced scientist. And a teenage girl who may be the world's last hope.Shana wakes up one morning to discover her little sister in the grip of a strange malady. She appears to be sleepwalking. She cannot talk and cannot be woken up. And she is heading with inexorable determination to a destination that only she knows. But Shana and her sister are not alone. Soon they are joined by a flock of sleepwalkers from across America, on the same mysterious journey. And like Shana, there are other “shepherds” who follow the flock to protect their friends and family on the long dark road ahead.For on their journey, they will discover an America convulsed with terror and violence, where this apocalyptic epidemic proves less dangerous than the fear of it. As the rest of society collapses all around them–and an ultraviolent militia threatens to exterminate them–the fate of the sleepwalkers depends on unraveling the mystery behind the epidemic. The terrifying secret will either tear the nation apart–or bring the survivors together to remake a shattered world.",Science Fiction,4.01,Del Rey Books,782,Hardcover,July 2nd 2019,https://www.goodreads.com/book/show/34019083-wanderers?from_choice=true
93,The City in the Middle of the Night,Charlie Jane Anders," ""If you control our sleep, then you can own our dreams... And from there, it's easy to control our entire lives."" Set on a planet that has fully definitive, never-changing zones of day and night, with ensuing extreme climates of endless, frigid darkness and blinding, relentless light, humankind has somehow continued apace -- though the perils outside the built cities are

""If you control our sleep, then you can own our dreams... And from there, it's easy to control our entire lives.""
Set on a planet that has fully definitive, never-changing zones of day and night, with ensuing extreme climates of endless, frigid darkness and blinding, relentless light, humankind has somehow continued apace -- though the perils outside the built cities are rife with danger as much as the streets below.But in a world where time means only what the ruling government proclaims, and the levels of light available are artificially imposed to great consequence, lost souls and disappeared bodies are shadow-bound and savage, and as common as grains of sand. And one such pariah, sacrificed to the night, but borne up by time and a mysterious bond with an enigmatic beast, will rise to take on the entire planet--before it can crumble beneath the weight of human existence.",Science Fiction,3.58,Tor Books,366,Hardcover,"February 12th, 2019",https://www.goodreads.com/book/show/37534907-the-city-in-the-middle-of-the-night?from_choice=true
94,A Memory Called Empire,Arkady Martine,"Ambassador Mahit Dzmare arrives in the center of the multi-system Teixcalaanli Empire only to discover that her predecessor, the previous ambassador from their small but fiercely independent mining Station, has died. But no one will admit that his death wasn't an accidentor that Mahit might be next to die, during a time of political instability in the highest echelons of
Ambassador Mahit Dzmare arrives in the center of the multi-system Teixcalaanli Empire only to discover that her predecessor, the previous ambassador from their small but fiercely independent mining Station, has died. But no one will admit that his death wasn't an accident—or that Mahit might be next to die, during a time of political instability in the highest echelons of the imperial court.Now, Mahit must discover who is behind the murder, rescue herself, and save her Station from Teixcalaan's unceasing expansion—all while navigating an alien culture that is all too seductive, engaging in intrigues of her own, and hiding a deadly technological secret—one that might spell the end of her Station and her way of life—or rescue it from annihilation.",Science Fiction,4.17,Tor Books,462,Hardcover,"March 26th, 2019",https://www.goodreads.com/book/show/39863238-a-memory-called-empire?from_choice=true
95,Thrawn: Treason,Timothy Zahn,"Grand Admiral Thrawn faces the ultimate test of his loyalty to the Empire in this epic Star Wars novel from bestselling author Timothy Zahn.If I were to serve the Empire, you would command my allegiance. Such was the promise Grand Admiral Thrawn made to Emperor Palpatine at their first meeting. Since then, Thrawn has been one of the Empires most effective instruments,
Grand Admiral Thrawn faces the ultimate test of his loyalty to the Empire in this epic Star Wars novel from bestselling author Timothy Zahn.“If I were to serve the Empire, you would command my allegiance.” Such was the promise Grand Admiral Thrawn made to Emperor Palpatine at their first meeting. Since then, Thrawn has been one of the Empire’s most effective instruments, pursuing its enemies to the very edges of the known galaxy. But as keen a weapon as Thrawn has become, the Emperor dreams of something far more destructive.Now, as Thrawn’s TIE defender program is halted in favor of Director Krennic’s secret Death Star project, he realizes that the balance of power in the Empire is measured by more than just military acumen or tactical efficiency. Even the greatest intellect can hardly compete with the power to annihilate entire planets.",Media Tie In,4.24,Del Rey,334,Hardcover,"July 23rd, 2019",https://www.goodreads.com/book/show/43160651-thrawn?from_choice=true
96,The Future of Another Timeline,Annalee Newitz,"From Annalee Newitz, founding editor of io9, comes a story of time travel, murder, and the lengths we'll go to protect the ones we love.1992: After a confrontation at a riot grrl concert, seventeen-year-old Beth finds herself in a car with her friend's abusive boyfriend dead in the backseat, agreeing to help her friends hide the body. This murder sets Beth and her friends
From Annalee Newitz, founding editor of io9, comes a story of time travel, murder, and the lengths we'll go to protect the ones we love.1992: After a confrontation at a riot grrl concert, seventeen-year-old Beth finds herself in a car with her friend's abusive boyfriend dead in the backseat, agreeing to help her friends hide the body. This murder sets Beth and her friends on a path of escalating violence and vengeance as they realize many other young women in the world need protecting too.2022: Determined to use time travel to create a safer future, Tess has dedicated her life to visiting key moments in history and fighting for change. But rewriting the timeline isn’t as simple as editing one person or event. And just when Tess believes she's found a way to make an edit that actually sticks, she encounters a group of dangerous travelers bent on stopping her at any cost.Tess and Beth’s lives intertwine as war breaks out across the timeline--a war that threatens to destroy time travel and leave only a small group of elites with the power to shape the past, present, and future. Against the vast and intricate forces of history and humanity, is it possible for a single person’s actions to echo throughout the timeline?",Science Fiction,3.78,Tor Books,352,Hardcover,"September 24th, 2019",https://www.goodreads.com/book/show/43263237-the-future-of-another-timeline?from_choice=true
97,Here and Now and Then,Mike Chen,"To save his daughter, hell go anywhereand any-whenKin Stewart is an everyday family man: working in IT, trying to keep the spark in his marriage, struggling to connect with his teenage daughter, Miranda. But his current life is a far cry from his previous careeras a time-traveling secret agent from 2142.Stranded in suburban San Francisco since the 1990s after a botched
To save his daughter, he’ll go anywhere—and any-when…Kin Stewart is an everyday family man: working in IT, trying to keep the spark in his marriage, struggling to connect with his teenage daughter, Miranda. But his current life is a far cry from his previous career…as a time-traveling secret agent from 2142.Stranded in suburban San Francisco since the 1990s after a botched mission, Kin has kept his past hidden from everyone around him, despite the increasing blackouts and memory loss affecting his time-traveler’s brain. Until one afternoon, his “rescue” team arrives—eighteen years too late.Their mission: return Kin to 2142, where he’s only been gone weeks, not years, and where another family is waiting for him. A family he can’t remember.Torn between two lives, Kin is desperate for a way to stay connected to both. But when his best efforts threaten to destroy the agency and even history itself, his daughter’s very existence is at risk. It’ll take one final trip across time to save Miranda—even if it means breaking all the rules of time travel in the process.A uniquely emotional genre-bending debut, Here and Now and Then captures the perfect balance of heart, playfulness, and imagination, offering an intimate glimpse into the crevices of a father’s heart and its capacity to stretch across both space and time to protect the people that mean the most.",Science Fiction,3.77,Mira Books,336,Hardcover,"January 29th, 2019",https://www.goodreads.com/book/show/39217756-here-and-now-and-then?from_choice=true
98,Children of Ruin,Adrian Tchaikovsky,"The astonishing sequel to Children of Time, the award-winning novel of humanity's battle for survival on a terraformed planet.Thousands of years ago, Earth's terraforming program took to the stars. On the world they called Nod, scientists discovered alien life - but it was their mission to overwrite it with the memory of Earth. Then humanity's great empire fell, and the
The astonishing sequel to Children of Time, the award-winning novel of humanity's battle for survival on a terraformed planet.Thousands of years ago, Earth's terraforming program took to the stars. On the world they called Nod, scientists discovered alien life - but it was their mission to overwrite it with the memory of Earth. Then humanity's great empire fell, and the program's decisions were lost to time.Aeons later, humanity and its new spider allies detected fragmentary radio signals between the stars. They dispatched an exploration vessel, hoping to find cousins from old Earth.But those ancient terraformers woke something on Nod better left undisturbed.And it's been waiting for them.For more from Adrian Tchaikovsky, check out:Children of Time",Science Fiction,4.07,Orbit,571,Paperback,"May 14th, 2019",https://www.goodreads.com/book/show/41716930-children-of-ruin?from_choice=true
99,The Light Brigade,Kameron Hurley,"From the Hugo Awardwinning author of The Stars Are Legion comes a brand-new science fiction thriller about a futuristic war during which soldiers are broken down into light in order to get them to the front lines on Mars.They said the war would turn us into light.  I wanted to be counted among the heroes who gave us this better world.  The Light Brigade: its what soldiers
From the Hugo Award­­–winning author of The Stars Are Legion comes a brand-new science fiction thriller about a futuristic war during which soldiers are broken down into light in order to get them to the front lines on Mars.They said the war would turn us into light.  I wanted to be counted among the heroes who gave us this better world.  The Light Brigade: it’s what soldiers fighting the war against Mars call the ones who come back…different. Grunts in the corporate corps get busted down into light to travel to and from interplanetary battlefronts. Everyone is changed by what the corps must do in order to break them down into light. Those who survive learn to stick to the mission brief—no matter what actually happens during combat. Dietz, a fresh recruit in the infantry, begins to experience combat drops that don’t sync up with the platoon’s. And Dietz’s bad drops tell a story of the war that’s not at all what the corporate brass want the soldiers to think is going on. Is Dietz really experiencing the war differently, or is it combat madness? Trying to untangle memory from mission brief and survive with sanity intact, Dietz is ready to become a hero—or maybe a villain; in war it’s hard to tell the difference. A worthy successor to classic stories like Downbelow Station, Starship Troopers, and The Forever War, The Light Brigade is award-winning author Kameron Hurley’s gritty time-bending take on the future of war.",Science Fiction,3.97,Saga Press,356,Hardcover,"March 19th, 2019",https://www.goodreads.com/book/show/40523931-the-light-brigade?from_choice=true
100,The Institute,Stephen King,"In the middle of the night, in a house on a quiet street in suburban Minneapolis, intruders silently murder Luke Ellis's parents and load him into a black SUV. The operation takes less than two minutes. Luke will wake up at The Institute, in a room that looks just like his own, except theres no window. And outside his door are other doors, behind which are other kids with
In the middle of the night, in a house on a quiet street in suburban Minneapolis, intruders silently murder Luke Ellis's parents and load him into a black SUV. The operation takes less than two minutes. Luke will wake up at The Institute, in a room that looks just like his own, except there’s no window. And outside his door are other doors, behind which are other kids with special talents—telekinesis and telepathy—who got to this place the same way Luke did: Kalisha, Nick, George, Iris, and ten-year-old Avery Dixon. They are all in Front Half. Others, Luke learns, graduated to Back Half, “like the roach motel,” Kalisha says. “You check in, but you don’t check out.”In this most sinister of institutions, the director, Mrs. Sigsby, and her staff are ruthlessly dedicated to extracting from these children the force of their extranormal gifts. There are no scruples here. If you go along, you get tokens for the vending machines. If you don’t, punishment is brutal. As each new victim disappears to Back Half, Luke becomes more and more desperate to get out and get help. But no one has ever escaped from the Institute.As psychically terrifying as Firestarter, and with the spectacular kid power of It, The Institute is Stephen King’s gut-wrenchingly dramatic story of good vs. evil in a world where the good guys don’t always win.",Horror,4.21,Scribner,561,Hardcover,"September 10th, 2019",https://www.goodreads.com/book/show/43798285-the-institute?from_choice=true
101,Imaginary Friend,Stephen Chbosky,"Imagine... Leaving your house in the middle of the night. Knowing your mother is doing her best, but she's just as scared as you.Imagine... Starting a new school, making friends. Seeing how happy it makes your mother. Hearing a voice, calling out to you.Imagine... Following the signs, into the woods. Going missing for six days. Remembering nothing about what happened.
Imagine... Leaving your house in the middle of the night. Knowing your mother is doing her best, but she's just as scared as you.Imagine... Starting a new school, making friends. Seeing how happy it makes your mother. Hearing a voice, calling out to you.Imagine... Following the signs, into the woods. Going missing for six days. Remembering nothing about what happened.Imagine... Something that will change everything... And having to save everyone you love.",Horror,3.50,Grand Central Publishing,705,Hardcover,"October 1st, 2019",https://www.goodreads.com/book/show/43522576-imaginary-friend?from_choice=true
102,The Girl in Red,Christina Henry,"From the national bestselling author of Alice comes a postapocalyptic take on the perennial classic ""Little Red Riding Hood""...about a woman who isn't as defenseless as she seems.It's not safe for anyone alone in the woods. There are predators that come out at night: critters and coyotes, snakes and wolves. But the woman in the red jacket has no choice. Not since the
From the national bestselling author of Alice comes a postapocalyptic take on the perennial classic ""Little Red Riding Hood""...about a woman who isn't as defenseless as she seems.It's not safe for anyone alone in the woods. There are predators that come out at night: critters and coyotes, snakes and wolves. But the woman in the red jacket has no choice. Not since the Crisis came, decimated the population, and sent those who survived fleeing into quarantine camps that serve as breeding grounds for death, destruction, and disease. She is just a woman trying not to get killed in a world that doesn't look anything like the one she grew up in, the one that was perfectly sane and normal and boring until three months ago.There are worse threats in the woods than the things that stalk their prey at night. Sometimes, there are men. Men with dark desires, weak wills, and evil intents. Men in uniform with classified information, deadly secrets, and unforgiving orders. And sometimes, just sometimes, there's something worse than all of the horrible people and vicious beasts combined. Red doesn't like to think of herself as a killer, but she isn't about to let herself get eaten up just because she is a woman alone in the woods....",Horror,3.72, Berkley,293,Paperback,"June 18th, 2019",https://www.goodreads.com/book/show/42881101-the-girl-in-red?from_choice=true
103,The Invited,Jennifer  McMahon," A chilling ghost story with a twist: the   New York Times   bestselling author of   The Winter People   returns to the woods of Vermont to tell the story of a husband and wife who don't simply move into a haunted house, they start building one from scratch, without knowing it, until it's too late . . .  In a quest for a simpler life, Helen and Nate abandon the comforts of

A chilling ghost story with a twist: the 

New York Times

 bestselling author of 

The Winter People

 returns to the woods of Vermont to tell the story of a husband and wife who don't simply move into a haunted house, they start building one from scratch, without knowing it, until it's too late . . . 
In a quest for a simpler life, Helen and Nate abandon the comforts of suburbia and their teaching jobs to take up residence on forty-four acres of rural land where they will begin the ultimate, aspirational do-it-yourself project: building the house of their dreams. When they discover that this charming property has a dark and violent past, Helen, a former history teacher, becomes consumed by the legend of Hattie Breckenridge, a woman who lived and died there a century ago. As Helen starts carefully sourcing decorative building materials for her home--wooden beams, mantles, historic bricks--she starts to unearth, and literally conjure, the tragic lives of Hattie's descendants, three generations of ""Breckenridge women,"" each of whom died amidst suspicion, and who seem to still be seeking something precious and elusive in the present day.",Horror,3.79,Doubleday,353,Hardcover,"April 30th, 2019",https://www.goodreads.com/book/show/40065317-the-invited?from_choice=true
104,The Lost Causes of Bleak Creek,Rhett McLaughlin,"It's 1992 in Bleak Creek, North Carolina, a sleepy little place with all the trappings of an ordinary Southern town: two Baptist churches, friendly smiles coupled with silent judgments, and a seemingly unquenchable appetite for pork products. Beneath the towns cheerful façade, however, Bleak Creek teens live in constant fear of being sent to The Whitewood School, a local
It's 1992 in Bleak Creek, North Carolina, a sleepy little place with all the trappings of an ordinary Southern town: two Baptist churches, friendly smiles coupled with silent judgments, and a seemingly unquenchable appetite for pork products. Beneath the town’s cheerful façade, however, Bleak Creek teens live in constant fear of being sent to The Whitewood School, a local reformatory with a record of putting unruly teens back on the straight and narrow—a record so impeccable that almost everyone is willing to ignore the mysterious deaths that have occurred there over the past decade.At first, high school freshmen Rex McClendon and Leif Nelson believe what they’ve been told—that the students’ strange demises were all tragic accidents. But when the shoot for their low-budget horror masterpiece, PolterDog, goes horribly awry—and their best friend, Candice Boykins, is sent to Whitewood as punishment—Rex and Leif are forced to question everything they know about their unassuming hometown and its cherished school for delinquents. Eager to rescue their friend, Rex and Leif pair up with recent NYU film school grad Janine Blitstein to begin piecing together the unsettling truth of the school and its mysterious founder, Wayne Whitewood. What they find, with Candice’s life hanging in the balance, will leave them battling an evil beyond their wildest teenage imaginations—one that will shake Bleak Creek to its core.",Horror,4.03,Crown,326,Hardcover,"October 29th, 2019",https://www.goodreads.com/book/show/44034616-the-lost-causes-of-bleak-creek?from_choice=true
105,Full Throttle,Joe Hill,"A little door that opens to a world of fairy tale wonders becomes the blood-drenched stomping ground for a gang of hunters in Faun. A grief-stricken librarian climbs behind the wheel of an antique Bookmobile to deliver fresh reads to the dead in Late Returns. In By the Silver Water of Lake Champlain, two young friends stumble on the corpse of a plesiosaur at the waters
A little door that opens to a world of fairy tale wonders becomes the blood-drenched stomping ground for a gang of hunters in “Faun.” A grief-stricken librarian climbs behind the wheel of an antique Bookmobile to deliver fresh reads to the dead in “Late Returns.” In “By the Silver Water of Lake Champlain,” two young friends stumble on the corpse of a plesiosaur at the water’s edge, a discovery that forces them to confront the inescapable truth of their own mortality . . . and other horrors that lurk in the water’s shivery depths. And tension shimmers in the sweltering heat of the Nevada desert as a faceless trucker finds himself caught in a sinister dance with a tribe of motorcycle outlaws in “Throttle,” co-written with Stephen King.",Horror,4.05,William Morrow,480,Hardcover,"October 1st, 2019",https://www.goodreads.com/book/show/43801817-full-throttle?from_choice=true
