,title,author,description,genre,rating,publisher,pages,format,date,url
175,Prognosis: A Memoir of My Brain,Sarah Vallance,"The searing, wry memoir about a womans fight for a new life after a devastating brain injury.When Sarah Vallance is thrown from a horse and suffers a jarring blow to the head, she believes shes walked away unscathed. The next morning, things take a sharp turn as shes led from work to the emergency room. By the end of the week, a neurologist delivers a devastating
The searing, wry memoir about a woman’s fight for a new life after a devastating brain injury.When Sarah Vallance is thrown from a horse and suffers a jarring blow to the head, she believes she’s walked away unscathed. The next morning, things take a sharp turn as she’s led from work to the emergency room. By the end of the week, a neurologist delivers a devastating prognosis: Sarah suffered a traumatic brain injury that has caused her IQ to plummet, with no hope of recovery. Her brain has irrevocably changed.Afraid of judgment and deemed no longer fit for work, Sarah isolates herself from the outside world. She spends months at home, with her dogs as her only source of companionship, battling a personality she no longer recognizes and her shock and rage over losing simple functions she’d taken for granted. Her life is consumed by fear and shame until a chance encounter gives Sarah hope that her brain can heal. That conversation lights a small flame of determination, and Sarah begins to push back, painstakingly reteaching herself to read and write, and eventually reentering the workforce and a new, if unpredictable, life.In this highly intimate account of devastation and renewal, Sarah pulls back the curtain on life with traumatic brain injury, an affliction where the wounds are invisible and the lasting effects are often misunderstood. Over years of frustrating setbacks and uncertain triumphs, Sarah comes to terms with her disability and finds love with a woman who helps her embrace a new, accepting sense of self.",Autobiography,3.86,Little A,284,Hardcover,"August 1st, 2019",https://www.goodreads.com/book/show/43497893-prognosis?from_choice=true
176,Sounds Like Titanic,Jessica Chiccehitto Hindman,"A young woman leaves Appalachia for life as a classical musicianor so she thinks.When aspiring violinist Jessica Chiccehitto Hindman lands a job with a professional ensemble in New York City, she imagines she has achieved her lifelong dream. But the ensemble proves to be a sham. When the group performs, the microphones are never on. Instead, the music blares from a CD. The
A young woman leaves Appalachia for life as a classical musician—or so she thinks.When aspiring violinist Jessica Chiccehitto Hindman lands a job with a professional ensemble in New York City, she imagines she has achieved her lifelong dream. But the ensemble proves to be a sham. When the group “performs,” the microphones are never on. Instead, the music blares from a CD. The mastermind behind this scheme is a peculiar and mysterious figure known as The Composer, who is gaslighting his audiences with music that sounds suspiciously like the Titanic movie soundtrack. On tour with his chaotic ensemble, Hindman spirals into crises of identity and disillusionment as she “plays” for audiences genuinely moved by the performance, unable to differentiate real from fake.",Nonfiction,3.91,W. W. Norton  Company,256,Hardcover,"February 12th, 2019",https://www.goodreads.com/book/show/40180065-sounds-like-titanic?from_choice=true
177,"The Unwinding of the Miracle: A Memoir of Life, Death, and Everything That Comes After",Julie Yip-Williams,"As a young mother facing a terminal diagnosis, Julie Yip-Williams began to write her story, a story like no other. What began as the chronicle of an imminent and early death became something much more--a powerful exhortation to the living.That Julie Yip-Williams survived infancy was a miracle. Born blind in Vietnam, she narrowly escaped euthanasia at the hands of her
As a young mother facing a terminal diagnosis, Julie Yip-Williams began to write her story, a story like no other. What began as the chronicle of an imminent and early death became something much more--a powerful exhortation to the living.That Julie Yip-Williams survived infancy was a miracle. Born blind in Vietnam, she narrowly escaped euthanasia at the hands of her grandmother, only to flee with her family the political upheaval of her country in the late 1970s. Loaded into a rickety boat with three hundred other refugees, Julie made it to Hong Kong and, ultimately, America, where a surgeon at UCLA gave her partial sight. She would go on to become a Harvard-educated lawyer, with a husband, a family, and a life she had once assumed would be impossible. Then, at age thirty-seven, with two little girls at home, Julie was diagnosed with terminal metastatic colon cancer, and a different journey began.The Unwinding of the Miracle is the story of a vigorous life refracted through the prism of imminent death. When she was first diagnosed, Julie Yip-Williams sought clarity and guidance through the experience and, finding none, began to write her way through it--a chronicle that grew beyond her imagining. Motherhood, marriage, the immigrant experience, ambition, love, wanderlust, tennis, fortune-tellers, grief, reincarnation, jealousy, comfort, pain, the marvel of the body in full rebellion--this book is as sprawling and majestic as the life it records. It is inspiring and instructive, delightful and shattering. It is a book of indelible moments, seared deep--an incomparable guide to living vividly by facing hard truths consciously.With humor, bracing honesty, and the cleansing power of well-deployed anger, Julie Yip-Williams set the stage for her lasting legacy and one final miracle: the story of her life.",Autobiography,4.11,Random House,315,Hardcover,"January 8th, 2019",https://www.goodreads.com/book/show/39216478-the-unwinding-of-the-miracle?from_choice=true
178,What Is a Girl Worth?: My Story of Breaking the Silence and Exposing the Truth about Larry Nassar and USA Gymnastics,Rachael Denhollander,"Written by Rachael Denhollander, recipient of Sports Illustrated's Inspiration of the Year Award and one of Time's 100 Most Influential People (2018)""Who is going to tell these little girls that what was done to them matters? That they are seen and valued, that they are not alone and they are not unprotected?""Rachael Denhollander's voice was heard around the world when she
Written by Rachael Denhollander, recipient of Sports Illustrated's Inspiration of the Year Award and one of Time's 100 Most Influential People (2018)""Who is going to tell these little girls that what was done to them matters? That they are seen and valued, that they are not alone and they are not unprotected?""Rachael Denhollander's voice was heard around the world when she spoke out to end the most shocking US gymnastics scandal in history. The first victim to publicly accuse Larry Nassar, the former USA Gymnastics team doctor who sexually abused hundreds of young athletes, Rachael now reveals her full story for the first time. How did Nassar get away with it for so long? How did Rachael and the other survivors finally stop him and bring him to justice? And how can we protect the vulnerable in our own families, churches, and communities?What Is a Girl Worth? is the inspiring true story of Rachael's journey from an idealistic young gymnast to a strong and determined woman who found the courage to raise her voice against evil, even when she thought the world might not listen. In this crucial cultural moment of #metoo and #churchtoo,  this deeply personal and compelling narrative shines a spotlight on the physical and emotional impact of abuse, why so many survivors are reluctant to speak out, what it means to be believed, the extraordinary power of faith and forgiveness, and how we can learn to do what's right in the moments that matter most.Published by Tyndale, this inspirational, empowering book is available in both hardcover and e-book editions.",Nonfiction,4.66,Tyndale Momentum,352,Hardcover,"September 10th, 2019",https://www.goodreads.com/book/show/44288534-what-is-a-girl-worth?from_choice=true
179,"Wild Game: My Mother, Her Lover, and Me",Adrienne Brodeur,"A daughters tale of living in the thrall of her magnetic, complicated mother, and the chilling consequences of her complicity. On a hot July night on Cape Cod when Adrienne was fourteen, her mother, Malabar, woke her at midnight with five simple words that would set the course of both of their lives for years to come: Ben Souther just kissed me.    Adrienne instantly
A daughter’s tale of living in the thrall of her magnetic, complicated mother, and the chilling consequences of her complicity. On a hot July night on Cape Cod when Adrienne was fourteen, her mother, Malabar, woke her at midnight with five simple words that would set the course of both of their lives for years to come: Ben Souther just kissed me.    Adrienne instantly became her mother’s confidante and helpmate, blossoming in the sudden light of her attention, and from then on, Malabar came to rely on her daughter to help orchestrate what would become an epic affair with her husband’s closest friend. The affair would have calamitous consequences for everyone involved, impacting Adrienne’s life in profound ways, driving her into a precarious marriage of her own, and then into a deep depression. Only years later will she find the strength to embrace her life—and her mother—on her own terms.  Wild Game is a brilliant, timeless memoir about how the people close to us can break our hearts simply because they have access to them, and the lies we tell in order to justify the choices we make. It’s a remarkable story of resilience, a reminder that we need not be the parents our parents were to us.",Autobiography,4.01,Houghton Mifflin Harcourt,256,Hardcover,"October 15th, 2019",https://www.goodreads.com/book/show/43261166-wild-game?from_choice=true
180,The Five: The Untold Lives of the Women Killed by Jack the Ripper,Hallie Rubenhold,"Five devastating human stories and a dark and moving portrait of Victorian London - the untold lives of the women killed by Jack the Ripper.Polly, Annie, Elizabeth, Catherine and Mary-Jane are famous for the same thing, though they never met. They came from Fleet Street, Knightsbridge, Wolverhampton, Sweden and Wales. They wrote ballads, ran coffee houses, lived on country
Five devastating human stories and a dark and moving portrait of Victorian London - the untold lives of the women killed by Jack the Ripper.Polly, Annie, Elizabeth, Catherine and Mary-Jane are famous for the same thing, though they never met. They came from Fleet Street, Knightsbridge, Wolverhampton, Sweden and Wales. They wrote ballads, ran coffee houses, lived on country estates, they breathed ink-dust from printing presses and escaped people-traffickers. What they had in common was the year of their murders: 1888. The person responsible was never identified, but the character created by the press to fill that gap has become far more famous than any of these five women.For more than a century, newspapers have been keen to tell us that ‘the Ripper’ preyed on prostitutes. Not only is this untrue, as historian Hallie Rubenhold has discovered, it has prevented the real stories of these fascinating women from being told. Now, in this devastating narrative of five lives, Rubenhold finally sets the record straight, revealing a world not just of Dickens and Queen Victoria, but of poverty, homelessness and rampant misogyny. They died because they were in the wrong place at the wrong time – but their greatest misfortune was to be born a woman.",Nonfiction,4.23,Houghton Mifflin Harcourt,333,Hardcover,April 9th 2019,https://www.goodreads.com/book/show/37570548-the-five?from_choice=true
181,Midnight in Chernobyl: The Untold Story of the World's Greatest Nuclear Disaster,Adam Higginbotham,"The definitive, dramatic untold story of the Chernobyl nuclear power plant disaster, based on original reporting and new archival research.April 25, 1986, in Chernobyl, was a turning point in world history. The disaster not only changed the worlds perception of nuclear power and the science that spawned it, but also our understanding of the planets delicate ecology. With
The definitive, dramatic untold story of the Chernobyl nuclear power plant disaster, based on original reporting and new archival research.April 25, 1986, in Chernobyl, was a turning point in world history. The disaster not only changed the world’s perception of nuclear power and the science that spawned it, but also our understanding of the planet’s delicate ecology. With the images of the abandoned homes and playgrounds beyond the barbed wire of the 30-kilometer Exclusion Zone, the rusting graveyards of contaminated trucks and helicopters, the farmland lashed with black rain, the event fixed for all time the notion of radiation as an invisible killer.Chernobyl was also a key event in the destruction of the Soviet Union, and, with it, the United States’ victory in the Cold War. For Moscow, it was a political and financial catastrophe as much as an environmental and scientific one. With a total cost of 18 billion rubles—at the time equivalent to $18 billion—Chernobyl bankrupted an already teetering economy and revealed to its population a state built upon a pillar of lies. The full story of the events that started that night in the control room of Reactor No.4 of the V.I. Lenin Nuclear Power Plant has never been told—until now. Through two decades of reporting, new archival information, and firsthand interviews with witnesses, journalist Adam Higginbotham tells the full dramatic story, including Alexander Akimov and Anatoli Dyatlov, who represented the best and worst of Soviet life; denizens of a vanished world of secret policemen, internal passports, food lines, and heroic self-sacrifice for the Motherland. Midnight in Chernobyl, award-worthy nonfiction that reads like sci-fi, shows not only the final epic struggle of a dying empire but also the story of individual heroism and desperate, ingenious technical improvisation joining forces against a new kind of enemy.",Nonfiction,4.40,Simon & Schuster,538,Hardcover,"February 12th, 2019",https://www.goodreads.com/book/show/40538681-midnight-in-chernobyl?from_choice=true
182,Say Nothing: A True Story of Murder and Memory in Northern Ireland,Patrick Radden Keefe,"Patrick Radden Keefe writes an intricate narrative about a notorious killing in Northern Ireland and its devastating repercussions.In December 1972, Jean McConville, a thirty-eight-year-old mother of ten, was dragged from her Belfast home by masked intruders, her children clinging to her legs. They never saw her again. Her abduction was one of the most notorious episodes
Patrick Radden Keefe writes an intricate narrative about a notorious killing in Northern Ireland and its devastating repercussions.In December 1972, Jean McConville, a thirty-eight-year-old mother of ten, was dragged from her Belfast home by masked intruders, her children clinging to her legs. They never saw her again. Her abduction was one of the most notorious episodes of the vicious conflict known as The Troubles. Everyone in the neighborhood knew the I.R.A. was responsible. But in a climate of fear and paranoia, no one would speak of it. In 2003, five years after an accord brought an uneasy peace to Northern Ireland, a set of human bones was discovered on a beach. McConville's children knew it was their mother when they were told a blue safety pin was attached to the dress--with so many kids, she had always kept it handy for diapers or ripped clothes.Patrick Radden Keefe's mesmerizing book on the bitter conflict in Northern Ireland and its aftermath uses the McConville case as a starting point for the tale of a society wracked by a violent guerrilla war, a war whose consequences have never been reckoned with. The brutal violence seared not only people like the McConville children, but also I.R.A. members embittered by a peace that fell far short of the goal of a united Ireland, and left them wondering whether the killings they committed were not justified acts of war, but simple murders.",Nonfiction,4.43,Doubleday,441,Hardcover,February 26th 2019,https://www.goodreads.com/book/show/40163119-say-nothing?from_choice=true
183,Before and After: The Incredible Real-Life Stories of Orphans Who Survived the Tennessee Children's Home Society,Judy Christie,"7 hours, 57 minutesThe incredible, poignant true stories of victims of a notorious adoption scandal--some of whom learned the truth from Lisa Wingate's bestselling novel Before We Were Yours and were reunited with birth family members as a result of its wide reachFrom the 1920s to 1950, Georgia Tann ran a black-market baby business at the Tennessee Children's Home Society
7 hours, 57 minutesThe incredible, poignant true stories of victims of a notorious adoption scandal--some of whom learned the truth from Lisa Wingate's bestselling novel Before We Were Yours and were reunited with birth family members as a result of its wide reachFrom the 1920s to 1950, Georgia Tann ran a black-market baby business at the Tennessee Children's Home Society in Memphis. She offered up more than 5,000 orphans tailored to the wish lists of eager parents--hiding the fact that many weren't orphans at all, but stolen sons and daughters of poor families, desperate single mothers, and women told in maternity wards that their babies had died.The publication of Lisa Wingate's novel Before We Were Yours brought new awareness of Tann's lucrative career in child trafficking. Adoptees who knew little about their pasts gained insight into the startling facts behind their family histories. Encouraged by their contact with Wingate and award-winning journalist Judy Christie, who documented the stories of fifteen adoptees in this book, many determined Tann survivors set out to trace their roots and find their birth families.Before and After includes moving and sometimes shocking accounts of the ways in which adoptees were separated from their first families. Often raised as only children, many have joyfully reunited with siblings in the final decades of their lives. In Before and After, Wingate and Christie tell of first meetings that are all the sweeter and more intense for time missed and of families from very different social backgrounds reaching out to embrace better-late-than-never brothers, sisters, and cousins. In a poignant culmination of art meeting life, long-silent victims of the tragically corrupt system return to Memphis with Wingate and Christie to reclaim their stories at a Tennessee Children's Home Society reunion . . . with extraordinary results.",Nonfiction,4.02,Ballantine Books,320,Hardcover,"October 22nd, 2019",https://www.goodreads.com/book/show/44908411-before-and-after?from_choice=true
184,A Woman of No Importance: The Untold Story of the American Spy Who Helped Win World War II,Sonia Purnell,"In 1942, the Gestapo sent out an urgent transmission: ""She is the most dangerous of all Allied spies. We must find and destroy her.""The target in their sights was Virginia Hall, a Baltimore socialite who talked her way into Special Operations Executive, the spy organization dubbed Winston Churchill's ""Ministry of Ungentlemanly Warfare."" She became the first Allied woman
In 1942, the Gestapo sent out an urgent transmission: ""She is the most dangerous of all Allied spies. We must find and destroy her.""The target in their sights was Virginia Hall, a Baltimore socialite who talked her way into Special Operations Executive, the spy organization dubbed Winston Churchill's ""Ministry of Ungentlemanly Warfare."" She became the first Allied woman deployed behind enemy lines and--despite her prosthetic leg--helped to light the flame of the French Resistance, revolutionizing secret warfare as we know it.Virginia established vast spy networks throughout France, called weapons and explosives down from the skies, and became a linchpin for the Resistance. Even as her face covered wanted posters and a bounty was placed on her head, Virginia refused order after order to evacuate. She finally escaped through a death-defying hike over the Pyrenees into Spain, her cover blown. But she plunged back in, adamant that she had more lives to save, and led a victorious guerilla campaign, liberating swathes of France from the Nazis after D-Day.Based on new and extensive research, Sonia Purnell has for the first time uncovered the full secret life of Virginia Hall--an astounding and inspiring story of heroism, spycraft, resistance, and personal triumph over shocking adversity.",Nonfiction,4.21,Viking,368,Hardcover,April 9th 2019,https://www.goodreads.com/book/show/40595446-a-woman-of-no-importance?from_choice=true
185,The Only Plane in the Sky: An Oral History of 9/11,Garrett M. Graff,"The first comprehensive oral history of September 11, 2001a panoramic narrative woven from the voices of Americans on the front lines of an unprecedented national trauma.Over the past eighteen years, monumental literature has been published about 9/11, from Lawrence Wrights The Looming Tower, which traced the rise of al-Qaeda, to The 9/11 Commission Report, the governments
The first comprehensive oral history of September 11, 2001—a panoramic narrative woven from the voices of Americans on the front lines of an unprecedented national trauma.Over the past eighteen years, monumental literature has been published about 9/11, from Lawrence Wright’s The Looming Tower, which traced the rise of al-Qaeda, to The 9/11 Commission Report, the government’s definitive factual retrospective of the attacks. But one perspective has been missing up to this point—a 360-degree account of the day told through the voices of the people who experienced it. Now, in The Only Plane in the Sky, award-winning journalist and bestselling historian Garrett Graff tells the story of the day as it was lived—in the words of those who lived it. Drawing on never-before-published transcripts, recently declassified documents, original interviews, and oral histories from nearly five hundred government officials, first responders, witnesses, survivors, friends, and family members, Graff paints the most vivid and human portrait of the September 11 attacks yet. Beginning in the predawn hours of airports in the Northeast, we meet the ticket agents who unknowingly usher terrorists onto their flights, and the flight attendants inside the hijacked planes. In New York City, first responders confront a scene of unimaginable horror at the Twin Towers. From a secret bunker underneath the White House, officials watch for incoming planes on radar. Aboard the small number of unarmed fighter jets in the air, pilots make a pact to fly into a hijacked airliner if necessary to bring it down. In the skies above Pennsylvania, civilians aboard United Flight 93 make the ultimate sacrifice in their place. Then, as the day moves forward and flights are grounded nationwide, Air Force One circles the country alone, its passengers isolated and afraid. More than simply a collection of eyewitness testimonies, The Only Plane in the Sky is the historic narrative of how ordinary people grappled with extraordinary events in real time: the father and son working in the North Tower, caught on different ends of the impact zone; the firefighter searching for his wife who works at the World Trade Center; the operator of in-flight telephone calls who promises to share a passenger’s last words with his family; the beloved FDNY chaplain who bravely performs last rites for the dying, losing his own life when the Towers collapse; and the generals at the Pentagon who break down and weep when they are barred from rushing into the burning building to try to rescue their colleagues. At once a powerful tribute to the courage of everyday Americans and an essential addition to the literature of 9/11, The Only Plane in the Sky weaves together the unforgettable personal experiences of the men and women who found themselves caught at the center of an unprecedented human drama. The result is a unique, profound, and searing exploration of humanity on a day that changed the course of history, and all of our lives.",Nonfiction,4.73,Avid Reader Press / Simon  Schuster,485,Hardcover,"September 10th, 2019",https://www.goodreads.com/book/show/43821991-the-only-plane-in-the-sky?from_choice=true
